{
  "official_tag": "v4.0.3",
  "omahedron_tag": "omahedron-4.0.3",
  "state": "tagged",
  "kind": "patch",
  "omarchy_src_rev": "0534987009061cbe2dacdde4ad564092ab698d12",
  "previous_pin": "v4.0.2",
  "nixpkgs_pair": "nixos-26.05",
  "opened_on": "2026-09-11",
  "tagged_on": "2026-09-15",
  "security": true,
  "soak_applied": false,
  "checks": {
    "flake_check": true,
    "ledger_complete": true,
    "vm_pregate": false,
    "latitude_metal": true
  },
  "gaps": [
    "VM pre-gate still open (Castle eval-only for G3); Latitude GO-B 2026-09-15 is the metal sign",
    "Menu disabled-guard shape on quattro not yet on stable tag — v4.0.3 tag still uses when: mise-dir guards"
  ],
  "notes": "ADR-0005 security/patch train: no soak. Metal: lathe generation 24, omarchy 4.0.3, pin b85b8f3 plus this tag."
}
